{
  "$schema": "./Schema.Pipeline.json",
  "Name": "DebugGeometryGraphics",
  "Type": "Graphics",
  "RootSignature": "DefaultRootSignature",
  "VS": {
    "Source": "DebugGeometryShader.hlsl",
    "Identifier": "vs_6_6:VsMain"
  },
  "GS": {
    "Source": "DebugGeometryShader.hlsl",
    "Identifier": "gs_6_6:GsMain"
  },
  "PS": {
    "Source": "DebugGeometryShader.hlsl",
    "Identifier": "ps_6_6:PsMain"
  },
  "BlendState": {
    "AlphaToCoverageEnable": false,
    "IndependentBlendEnable": false,
    "RenderTargets": [
      {
        "BlendEnable": false,
        "BlendOp": "Add",
        "BlendOpAlpha": "Add",
        "DestBlend": "Zero",
        "DestBlendAlpha": "Zero",
        "LogicOp": "Noop",
        "LogicOpEnable": false,
        "RenderTargetWriteMask": 15,
        "SrcBlend": "One",
        "SrcBlendAlpha": "One"
      }
    ]
  },
  "SampleMask": 4294967295,
  "RasterizerState": {
    "FillMode": "Solid",
    "CullMode": "None",
    "FrontCounterClockwise": false,
    "DepthBias": 0,
    "DepthBiasClamp": 0,
    "SlopeScaledDepthBias": 0,
    "DepthClipEnable": true,
    "MultisampleEnable": false,
    "AntialiasedLineEnable": false,
    "ForcedSampleCount": 0,
    "ConservativeRaster": "Off"
  },
  "DepthStencilState": {
    "DepthEnable": true,
    "DepthWriteMask": "Zero",
    "DepthFunc": "LessEqual",
    "StencilEnable": false,
    "StencilReadMask": 255,
    "StencilWriteMask": 255,
    "FrontFace": {
      "StencilFailOp": "Keep",
      "StencilDepthFailOp": "Keep",
      "StencilPassOp": "Keep",
      "StencilFunc": "Always"
    },
    "BackFace": {
      "StencilFailOp": "Keep",
      "StencilDepthFailOp": "Keep",
      "StencilPassOp": "Keep",
      "StencilFunc": "Always"
    }
  },
  "IBStripCutValue": "Disabled",
  "PrimitiveTopologyType": "Point",
  "RTVFormats": [
    "R8G8B8A8_UNORM"
  ],
  "DSVFormat": "D24_UNORM_S8_UINT",
  "SampleDesc": {
    "Count": 1,
    "Quality": 0
  },
  "NodeMask": 0,
  "Flags": []
}
